{
  "schema_version": "hqa.hal_manifest.v1",
  "manifest_id": "HAL-RISK-FIELD-V0-001",
  "requested_action": "dry_run_review_route_review_and_quarantine_proposal",
  "target": "Q_1",
  "execution_mode": "dry_run",
  "safety_boundary": "No physical command emitted. Vendor controller retains authority.",
  "requires_human_approval": true
}